{
  "$schema": "https://json-schema.org/draft/2020-12/schema",
  "title": "Requirement Plan Result",
  "type": "object",
  "additionalProperties": false,
  "required": [
    "project_dir",
    "task_name",
    "case_count",
    "files_created",
    "notes",
    "ai_handoff_path",
    "executor_request_path",
    "handoff_bundle_path",
    "ai_handoff_prompt"
  ],
  "properties": {
    "project_dir": { "type": "string" },
    "task_name": { "type": "string" },
    "case_count": { "type": "integer" },
    "files_created": {
      "type": "array",
      "items": { "type": "string" }
    },
    "notes": {
      "type": "array",
      "items": { "type": "string" }
    },
    "ai_handoff_path": { "type": "string" },
    "executor_request_path": { "type": "string" },
    "handoff_bundle_path": { "type": "string" },
    "ai_handoff_prompt": { "type": "string" }
  }
}
